{
  "schemaVersion": 1,
  "builtAt": "2026-09-30T21:44:36.462Z",
  "appVersion": "0.2.0+0000000",
  "languages": [
    {
      "code": "eng",
      "autonym": "English",
      "name": "English",
      "direction": "ltr",
      "script": "Latn"
    },
    {
      "code": "arb",
      "autonym": "العربية",
      "name": "Arabic",
      "direction": "rtl",
      "script": "Arab"
    },
    {
      "code": "spa",
      "autonym": "Español",
      "name": "Spanish",
      "direction": "ltr",
      "script": "Latn"
    },
    {
      "code": "hau",
      "autonym": "Hausa",
      "name": "Hausa",
      "direction": "ltr",
      "script": "Latn"
    }
  ],
  "entries": [
    {
      "packId": "eng.1CH-4-21-23",
      "language": "eng",
      "pericope": "1CH-4-21-23",
      "book": "1CH",
      "title": "1 Chronicles 4:21–23",
      "resourceTypes": ["guide", "scripture", "term", "image", "video", "audio"],
      "tierBytes": {
        "text": 21612,
        "phone": 2345612,
        "medium": 4677612,
        "original": 10471248
      },
      "sourceRevision": "b2ac9646083a9cdbeeaf817b536b8eeaaf5e386d7006acee66dae6248c6c4efc",
      "provenance": {
        "text": {
          "source": 7,
          "generated": 0,
          "missing": 0
        },
        "audio": {
          "source": 3,
          "generated": 0,
          "missing": 61
        },
        "description": {
          "source": 0,
          "generated": 0,
          "missing": 2
        }
      },
      "manifestSha256": "1c495e9721bde0e3d9be226ab70b83e516b09d06c463b3323a9eea3fa5a61645"
    },
    {
      "packId": "eng.1CH-1-1-7",
      "language": "eng",
      "pericope": "1CH-1-1-7",
      "book": "1CH",
      "title": "1 Chronicles 1:1–7",
      "resourceTypes": ["guide", "scripture", "term", "audio"],
      "tierBytes": {
        "text": 35486,
        "phone": 3291486,
        "medium": 6507486,
        "original": 13889910
      },
      "sourceRevision": "766188fa85d2ccb800e2c326eaf1263ac4d490539050fff6aa26e6d07bf81ddf",
      "provenance": {
        "text": {
          "source": 6,
          "generated": 0,
          "missing": 0
        },
        "audio": {
          "source": 2,
          "generated": 0,
          "missing": 114
        },
        "description": {
          "source": 0,
          "generated": 0,
          "missing": 0
        }
      },
      "manifestSha256": "3156225c4766ff203637c2d650938e590c1c458868c6899756869c82d17b2c92"
    },
    {
      "packId": "eng.1CH-1-8-16",
      "language": "eng",
      "pericope": "1CH-1-8-16",
      "book": "1CH",
      "title": "1 Chronicles 1:8–16",
      "resourceTypes": ["guide", "scripture", "term", "audio"],
      "tierBytes": {
        "text": 32725,
        "phone": 2952725,
        "medium": 5832725,
        "original": 12543149
      },
      "sourceRevision": "766188fa85d2ccb800e2c326eaf1263ac4d490539050fff6aa26e6d07bf81ddf",
      "provenance": {
        "text": {
          "source": 6,
          "generated": 0,
          "missing": 0
        },
        "audio": {
          "source": 2,
          "generated": 0,
          "missing": 100
        },
        "description": {
          "source": 0,
          "generated": 0,
          "missing": 0
        }
      },
      "manifestSha256": "12e9dbae6f56d9b48c4230875e66b51c1adffde4d79efbc4653b8ecfc37d0320"
    },
    {
      "packId": "spa.LUK-1-1-4",
      "language": "spa",
      "pericope": "LUK-1-1-4",
      "book": "LUK",
      "title": "Lucas 1:1–4",
      "resourceTypes": ["guide", "scripture", "term", "map"],
      "tierBytes": {
        "text": 13412,
        "phone": 1651412,
        "medium": 6289412,
        "original": 23505236
      },
      "sourceRevision": "ca70cb7269e7e663a766f8f92c56ffcec4d7df6456cae7ee9b93d34cd1ad1120",
      "provenance": {
        "text": {
          "source": 4,
          "generated": 0,
          "missing": 0
        },
        "audio": {
          "source": 0,
          "generated": 0,
          "missing": 38
        },
        "description": {
          "source": 0,
          "generated": 0,
          "missing": 3
        }
      },
      "manifestSha256": "cc62259e399b1f52a1797af3623b0771b73fea06c3623a1728bceedde98c1af3"
    },
    {
      "packId": "spa.LUK-1-5-25",
      "language": "spa",
      "pericope": "LUK-1-5-25",
      "book": "LUK",
      "title": "Lucas 1:5–25",
      "resourceTypes": ["guide", "scripture", "term", "image"],
      "tierBytes": {
        "text": 48276,
        "phone": 3016276,
        "medium": 6120276,
        "original": 11736276
      },
      "sourceRevision": "748fa068cd8d884fd8d044514b3f7252e81c3a74831555d351a846c6ded353ea",
      "provenance": {
        "text": {
          "source": 8,
          "generated": 0,
          "missing": 0
        },
        "audio": {
          "source": 0,
          "generated": 0,
          "missing": 122
        },
        "description": {
          "source": 0,
          "generated": 0,
          "missing": 4
        }
      },
      "manifestSha256": "d97c31dd957e9ad54e166b9895d464118447a9ca0c5105202d85dff89e4c6588"
    },
    {
      "packId": "hau.LUK-6-17-19",
      "language": "hau",
      "pericope": "LUK-6-17-19",
      "book": "LUK",
      "title": "Luke 6:17–19",
      "resourceTypes": ["guide", "term", "image", "map"],
      "tierBytes": {
        "text": 21113,
        "phone": 1463113,
        "medium": 4041113,
        "original": 11251721
      },
      "sourceRevision": "fb58e53d6c79c4c6d3e81dd59bfef6dc2f3dda4ae72291f2071e03d2947e284c",
      "provenance": {
        "text": {
          "source": 1,
          "generated": 0,
          "missing": 10
        },
        "audio": {
          "source": 0,
          "generated": 0,
          "missing": 48
        },
        "description": {
          "source": 0,
          "generated": 0,
          "missing": 5
        }
      },
      "manifestSha256": "3293d98cf248efc163d7ece539c0f02de1acf4aafd3b5ef061838cd7b081ce38"
    },
    {
      "packId": "hau.LUK-6-20-26",
      "language": "hau",
      "pericope": "LUK-6-20-26",
      "book": "LUK",
      "title": "Luke 6:20–26",
      "resourceTypes": ["guide", "term"],
      "tierBytes": {
        "text": 27533,
        "phone": 1515533,
        "medium": 3003533,
        "original": 5979533
      },
      "sourceRevision": "38c156084fdd98c07dc163a7b3266188ea9b8f08eda62afa7ef4878135367d5a",
      "provenance": {
        "text": {
          "source": 1,
          "generated": 0,
          "missing": 8
        },
        "audio": {
          "source": 0,
          "generated": 0,
          "missing": 65
        },
        "description": {
          "source": 0,
          "generated": 0,
          "missing": 0
        }
      },
      "manifestSha256": "2eaa667b51fd2598eda5dd2308c3ad6b63ae3e035d96be90e5b2340a636148a5"
    }
  ]
}
